text,time,votes,replies
Vai santos,há 2 anos,0,
Era pra ter sido uns 4 pro Atlético PR,há 2 anos,0,
"esse atl achou que ganhando do flamengo ja era campeao, rss",há 2 anos,0,
Concordo plenamente com oq o narrador falou,há 2 anos,0,
MAZUCCO saiu tudo melhorou,há 2 anos,0,
Prefiro a queda do Santos do que uma possível queda do Bahia ou do Juventude,há 2 anos,0,
"nos ganhamos ,mais precisa melhora a defesa ,que sufoco",há 2 anos,0,
"Sou santista e não podemos ser hipócritas porque o fator sorte contou muito nesse jogo:

Era pra ter sido uns 3 a 1 pro Athlético:

*Bola que o zagueiro salvou da sobra que quando o goleiro defendeu, se não é ele tem outro atacante lá pra completar; 
*Passe mandado pelo ala direito que passou por toda a defesa do Santos e o atacante completou mandando por cima do gol ... 
*Bola do travessão

Tudo bola de endereço à gol ...

O Athlético soube se impor muito bem, mas vamos Santos ...",há 2 anos,0,
Vamo Santos.  🖤💥,há 2 anos,0,
Ganharam de cagada..,há 2 anos,0,
"Time gigante passa pela torcida, coisa que o Santos não tem, e comemorar que não será rebaixado é coisa de clubeco.",há 2 anos,0,1
Não sei como o Flamengo perde pra um time dese do atlético Paranaense,há 2 anos,0,
SANTOS 01/11/2021,há 2 anos,0,
"Que narração espetacular, como se chama o narrador?",há 2 anos,0,
"Só deu furacão depois do gol do Santos, pqp😣",há 2 anos,0,
Vamo santos,há 2 anos,1,
ขอบคุณครับ,há 2 anos,0,
Com uma ajuda de Deus mais oque importa foi que venceu 🙏,há 2 anos,0,
Santos só fez o gol e mais nada... ganhou na sorte pq o athletico tava com os reservas,há 2 anos,0,
"Narração MC Mudinho.
Gol neles Santos.
He he he.",há 2 anos,1,
"Todo time brasileiro já comemorou permanência, não tenha um que não tenha comemorado",há 2 anos,0,
"Somente meu patrão que paga meu salário, por mim que se f.... Essa turma de jogador.",há 2 anos,0,
"Jogando em Casa e Desperdiçar Tanta Chances de Gols Claras , Santos teve Muita Sorte...🤙🤙🤙",há 2 anos,0,
"se deus quiser o santos vai ser rebaixado, ele a de querer",há 2 anos,0,
o que o atletico pr faz espero um dia meu papao fazer pelo menos a metade. ( nao gosto do atletico mas é um trabalho serio e de respeito com o torcedor),há 2 anos,0,
"TIME GRANDE NAO CAI MANO , SEGUNDO LUGAR AS VEZES MAS SEGUNDA DIVISÃO JAMAIS",há 2 anos,0,
"Furacão teve cinco chances seguidas para empatar e virar o jogo, porém, a ansiedade atrapalhou o time. As defesas do goleiro adversário, foram depois dessa sequência, enfim, os três pontos foram para quem fez gol. CAP precisa despertar para o Brasileirão novamente!",há 2 anos (editado),0,
João Paulo paredão ❤️😍😍😍,há 2 anos,1,
"Juro que não entendo a porra do time do Atlético Paranaense, vai lá no Rio de Janeiro, dá um banho tático no time do Flamengo, mete 3 X 0 e classifica para a final da Copa do Brasil e em casa, na Arena da Baixada não consegue ganha um jogo destas merdas de time como Santos, Bahia, etc? Este Valentim é uma porcaria de técnico, qualquer outro faria o Furacão meter uma goleada no timeco do Santos. O Atlético Paranaense até parece estar negociando os resultados em casa, não é possível tanta incompetência em ganhar os jogos em casa pelo Brasileiro. Precisamos de bons reforços e um técnico com capacidade, Alberto Valentim é técnico para os times da segunda divisão não para o Atlético Paranaense.",há 2 anos,0,
"MELHOR NARRADOR QUE JA OUVI, SENSACIONAL GE 👍🏼",há 2 anos,0,
A série b não é o lugar do santos 👍,há 2 anos,1,
"Com esse timinho acho que a  segundona tá próxima, espere só pra tu ver.kkkkkkkkk",há 2 anos,0,
Quando o goleiro é o melhor do jogo é porque o time não jogou lá essas coisas.,há 2 anos,0,
Que bosta meu vuração perdeu pro time desse ai e rui,há 2 anos,2,
Nossa o goleiro do Santos é um monstro se não fosse ele teria sido uns 5 x 1,há 2 anos,0,
Sou torcedor do galo esse atlético paranaense vai dar muito trabalho na final da copa do Brasil contra meu galão,há 2 anos,0,
"N é sendo chato, mas essa zaga do santos ta horrivel, os cara alto em bola parada n pula alto, fura, desentrozada... totalmente perdida",há 2 anos,0,
Bela vitória do santos e que partida do Joao Paulo.,há 2 anos,0,
O goleiro do santos agarrou demais mn,há 2 anos,0,
Suaram  a bundinha mas não vao cair mesmo,há 2 anos,0,
"Tô falando q o jogo do atlético contra o Flamengo foi comprado, perdeu pro Santos kkkkk",há 2 anos,0,
"Normal, o maior venceu... Agora é focar no próximo jogo",há 2 anos,0,
1:06 olha o gol que o cara perdeu,há 2 anos,0,
Deu a lógica. Ponto.,há 2 anos,0,
MAIOR DO BRASIL!!!!,há 2 anos,1,
Se ganhamos do Palmeiras vamos sonha com a Parte mas alta da tabela eu vejo como um Jogo Chave para nossa Redensáo no campeonato e acho que dá para ganha pois o time começa te a cara do Carilli que vimos no Corinthians um time cascudo que sabe sofre e não se abate com Presao,há 2 anos (editado),1,
TIME GIGANTE NÃO DISPUTA SEGUNDA DIVISÃO... 🤍🖤🤍🖤,há 2 anos,0,
.,há 2 anos,0,
Isso ai meu PEIXAO,há 2 anos,0,
"A vitória veio, mas o Wagner Palha deu uns bons sustos (o Robson Reis deu uma furada bisonha numa bola que quase comprometeu o time).",há 2 anos,1,
"Ganha do Flamengo e depois perde pro Santos... eh Atlético Paranaense,  às vezes furacão, às vezes decepção...",há 2 anos (editado),0,
Teve sorte o Santos pra ganhar esse jogo. Ufa!!,há 2 anos,0,
Cala boca secador 🤫🤫🤫 respeita o Santos,há 2 anos,0,
"Santos e série B na combina fi, ixxxxxxxquece, tem que respeitar o maio de SP 😌😌😌😌❤️",há 2 anos,0,
"Se perdeu do Santos vsi ganhar do Flamengo ? Duvido,",há 2 anos,0,
Era só vencer o Santos pro Atlético fazer o Brasil feliz de novo. Mas era pedir muito pqp,há 2 anos,0,
Vem Mathecka,há 2 anos,0,
Santos na serie b,há 2 anos,0,
que venha as pepas 🔪🔪🐷🐷,há 2 anos,0,
"Ajaaaa coração obrigado meu Deus.....
Eu tava ansioso demais com esse Atlético paranaense e esse campo sitentico mais graças à Deus santos venceu...
Dale..
Dale peixe 🐟 🐟 🐟",há 2 anos,0,
Athetico PR perdeu um milhão de gols mds,há 2 anos,0,
Um dia vcs cairão assim como os outros times e tbm irão cair flamengo e são paulo,há 2 anos,0,1
Não comemorem santistas ainda tem muito chão pela frente,há 2 anos,0,1
Poderoso atlético pr 😂😂😂😂😂😂😂,há 2 anos,0,
Melhor narrador que eu já vi,há 2 anos,0,
"EU JÁ SABIA QUE O SANTOS NÃO IRIA JOGAR A SÉRIE B, AGORA AFIRMO SANTOS NÃO CAI.",há 2 anos,1,
0:20 o João Paulo salvou ali KKK goleirão MDS joga mt,há 2 anos,0,
"Santos tá errando muito lá atrás,tem q melhorar isso dae se não a série b espera",há 2 anos,1,
"Cadê a antizada nojenta agora? 
Cadê o ""Arêrê"", torcidinha do atlético e fluminense? 
Série B VOCÊS conhecem, eu não!",há 2 anos (editado),0,
SANTOS MAIOR DO MUNDOOOO 🤟🐋🐋🐋🐋,há 2 anos,0,
BOA SANTOS ISSO AI AGORA AS GAZELAS ESTÃO MAIS PRESSIONADAS E TOMARA Q O PALMEIRAS GANHE DELAS,há 2 anos,1,
Oooooooh ooooooooh vamo ganha santoss vamo ganha santooooooss.. pra cima krlh,há 2 anos,1,
Time Grande não cai,há 2 anos,0,
Essa zaga precisa ser reforçada,há 2 anos,0,
Sou São paulino mas eu reconheço que o Santos é o maior do Brasil,há 2 anos,1,
BORA SANTOOOOOOOOS TIME DO CARALHO,há 2 anos,1,
Esse atacante do Atlético paranaense que perdeu aquele gol deve ser parente do Pablo !!!! Kkkkkk,há 2 anos,1,1
"PA RABÉNS PRO NOSSO PEIXÃO,AGORA ESSE TIME DO FURACÃO É BOM DEMAIS",há 2 anos,0,
O meu Santos tá fraquinho.,há 2 anos,0,
Time Grande não Cai Caraiii Aqui é Santos Porra❤🙏,há 2 anos,0,
"O athletico tá fudido. Só jogo difícil na sequência. Se não se espertar, capaz de ser campeão da Sul americana e copa do Brasil na série B",há 2 anos,0,
"Até lá  Pode cair pra B , C , D o alfabeto todo que eu vou continuar torcendo pro meu Clube e não vai ser um Mísero rebaixamento que vai tirar isso de mim 🤍🖤🐋⚡",há 2 anos,0,
Nem me fale,há 2 anos,0,
Nascidos na mesma maternidade kkkk,há 2 anos,1,
Vão porra aqui é santos caralho,há 2 anos,0,
Madson e Yago Pikachu são os alas laterais que mais fazem gols no futebol Brasileiro,há 2 anos,0,
Cazao Noia,há 2 anos,0,
Como Flamengo perdeu pra esse time 🤦‍♂️🤦‍♂️🤦‍♂️🤦‍♂️,há 2 anos,0,
Isso prova que o Flamengo é muito importante no futebol brasileiro enfrenta o Flamengo é motivado,há 2 anos,0,
"Time fubá do Santos ganhou kkkk
 Esse time grande do Atlético paranaense e muito antipático esses time.",há 2 anos,0,
Atlhetico do paraguaio vai acabar caindo,há 2 anos,0,
S Santos campeão sou santista,há 2 anos,0,
Narração histórica,há 2 anos,1,
Dale peixe do coração ♥,há 2 anos,0,
1:10 que foi aquilo???,há 2 anos,2,
Sou santista e o j.p é bom demais o foda é q a seleção é mafia ele só vai pra seleção quando sair do santos igual o l.veríssimo .,há 2 anos,0,
Santos e segunda divisão não existem na mesma frase.,há 2 anos,0,
Bora pra cima meu peixe! ❤️❤️❤️,há 2 anos,0,
Sou Flamengo gosto muito Santos FC clube o maior di são Paulo,há 2 anos,0,
"Manooo.
Esse João Paulo e muito bom!",há 2 anos,0,
Santos meu amor...,há 2 anos,0,
Salvo várias vezes por João Paulo,há 2 anos,0,
Olha o que a defesa do Santos faz pqp.,há 2 anos,0,
time grande não cai porra,há 2 anos,0,
"Parece que a maré virou, a sorte esta do lado do santos.",há 2 anos,1,
Time grande cai porém o santos é gigante # eim 2 as vzs na segunda jamaiz poha o maior do mundo karalho,há 2 anos,0,
Santos é incaivel,há 2 anos,0,
"Inacreditável como o Atl.Paranaense perdeu gol fácil .o santos marca a distância, deixa os caras fazer as jogada tranquilo .",há 2 anos,0,
"Vitória excelente do santos ☺️ 
👏 Por essa Grande narração do jogo.",há 2 anos (editado),0,
É o peixe 🐟 porra,há 2 anos,0,
"Aos que já se sujaram na lama de B,,meus pêsames...",há 2 anos,0,
Sair zika mais um Vitória do.Peixao😍😍😍😍😍,há 2 anos,0,
"Santos sempre Santos,mais de 100 anos na primeira divisão  🐋⚪⚫",há 2 anos,0,
"Os caras vai no Rio e massacra o Fla,pra depois perder pro santos.abre o olho furacão,coxa tá voltando.vcs vão cair",há 2 anos,0,
"Eu sempre falava time grande não cai....

Flamengo apanha do Fluminense,
O Santos massacra

Flamengo perde para o Atlético,
O Santos ganha

Como esse flamengo é ruim kkkkk",há 2 anos,0,
"... não dá para saber se, foi um milagre o Athletico ter ganho do Flamengo ou se houve um poupamento dos jogadores",há 2 anos,0,
É bom que o Palmeiras entregue pro Grêmio pra esses filhos da puta se lascarem,há 2 anos,0,2
Ninguém consegue explicar até hj como o Madson era reserva do Pará pqp 🤦🏾‍♂️😭,há 2 anos,5,
Ainda nem escapou do rabaixamento e tão comemorando kkkkkk que fase,há 2 anos,0,
Furacão Não  Precisa  Chegar  No G4 Pra Ir Ora Libertadores......Ele Gosta É  De Decisão.,há 2 anos,0,
Cap.lixo único grande kkkkkkkkkkkkkkkkkkk,há 2 anos,0,
Furacao mereceia no minimo um empate,há 2 anos,0,
DALE PEIXÃO,há 2 anos,0,
Palmeiras melhor do Brasil,há 2 anos,1,
"Santos já saiu e muito da zona, série b é coisa de parmeira e Corinthians",há 2 anos,0,
 @mateuslopes3394  Saiu muito não. Tem 4 times atrás do Santos na tabela e eles estão com 1 jogo a menos.,há 2 anos,0,
O lelê o Lala segunda divisão é pra porco e pra gambá 🖤🤍,há 2 anos,0,
SANTOS é Gigante! ⚪️⚫️🦈,há 2 anos,3,1
"Quer pontuar no Brasileirão, pegue o furacão. 🤷‍♂️",há 2 anos,0,
1:05 alguém me explica como alguém pede um gol desses ????,há 2 anos,0,
Toma atlético kkkkkkkkkk,há 2 anos,0,
O Atlético perdeu muitos gols. Aff!,há 2 anos,0,
Essa ai é o PODEROSO furacão 🤔😅,há 2 anos,0,
série b e pra porco e mosqueteiro kkk,há 2 anos,0,
Fiquei emoçionado com essa narração 😢,há 2 anos,0,
Santao ta on,há 2 anos,0,
"Sou Santista, mas meu time tomou um vareio e levou 3 pontos. Vida de comentarista não deve ser fácil.
Vide Renato Gaúcho finalista da Libertadores e contestado.
Ufa! Time grande não cai. Tomara que não caia mesmo!",há 2 anos,0,
"""Em segundo as vezes, na segunda jamais"" 
               ""Torcida jovem"" 2009",há 2 anos,1,
Esse athletico do Valentim é horroroso só o flamengo mesmo pra perder pra esse time,há 2 anos,0,
Sou palmeirense mas dos grandes sem virada de mesa o Santos foi o único que não caiu,há 2 anos,7,
Narrador top,há 2 anos,0,
Foi Deus kkkk,há 2 anos,0,
Esse patético é piada pronta vai ganhar nada,há 2 anos,0,
A zaga do Santos tá muito fraca sempre passa bola nessa porra sai fora Zé,há 2 anos,0,
Alvinegro praiano.🖤🤍🐳,há 2 anos,0,
Antes do jogo..repórter perguntou pro Madson..como vcs vão encarar Thiago Heleno e Ze Ivaldo?? Madson respondeu: eles são grandes mais nois é ruim..aqui é Santos parceiro..se liga mané..,há 2 anos,0,
⚪⚫,há 2 anos,0,
Na segunda jamais !,há 2 anos,2,2
"Santos 1 x 3 Atlético mineiro


Santos: papai ele me humilhou
Flamengo: pode deixar que o malvadão vai resolver.
Atlético mineiro: pra quê agredir?",há 2 anos,3,6
é só uma força do CAP pro Santos n ser rebaixado tá,há 2 anos,1,
Eu te amo santosssasssaasasss,há 2 anos,2,
Em segundo? AS VEZES! Na segunda? JAMAIS! ⚪️⚫️,há 2 anos,0,
Que partida do João Paulo ❤️🙏🏽,há 2 anos,0,
"Como o Santos n perdeu mds , mas ainda bem né",há 2 anos,1,2
"O goleiro João Paulo é 50% do Time, monstrooooo",há 2 anos,0,
"FINALMENTE o Santos eliminou o estilo que o Fernando Diniz encrostou nessa rapaziada, tava triste de ver os jogos, recuando bolas, zagueiro armando, 0 chutes no gol. Graças a Deus eles se livraram dessa lavagem cerebral que o Diniz colocou nessa rapaziada.",há 2 anos,0,
"SANTOS é SANTOS porra, gigante cai não série B nunca, respeita K7",há 2 anos,0,
Kkk santos massacrados achou um golzinho e pronto,há 2 anos,0,
E o Tite chamou o Chapecó de terceiro goleiro kkkkkkkkkkkkkkkkkkkkkkkkkkkkkkk,há 2 anos,0,
João Paulo já é seleção um monstro no gol,há 2 anos,0,
Vai pra cima deles Santos 🥰,há 2 anos,0,
"Te amo peixe, deu fora porra! Kk",há 2 anos,0,
INCAÍVEL!,há 2 anos,0,1
Não foi esse o time que humilhou o flamerda?,há 2 anos,0,
Só com o flamengo eles jogam bem. Que time horroroso.,há 2 anos,0,
"AOS 1:07 VEMOS QUE O WAGNER PALHA É PÉSSIMO E NÃO DEVE JOGAR NUNCA MAIS TITULAR , JÁ NÃO É DE HOJE QUE ELE É HORROSO NÃO MARCA NEM DEFENDE NADA",há 2 anos,0,
"Hoje fui perder minha virgindade. No momento que abaixei as calças ela viu que meu instrumento era muito pequeno, fiquei com muita vergonha. Porém, ela me disse que estava tudo bem, pequeno mesmo era o SPFC, naquele momento percebi que ela era a mulher da minha vida.",há 2 anos,0,
Pera né kkk falta 10 rodadas,há 2 anos,1,
 @elbersantoss__  vai gambá,há 2 anos,0,
Mais Santos e Atlético continua maior que o Flamengo,há 2 anos,1,
Santos ganhou do Atlético seu solubre,há 2 anos,0,
"Pera

Flamengo: papaaaiiii, o Atlético e o fluminense meteram 3 em mim😭😭😭

Santos: perae filhao",há 2 anos,0,
 @fabriciocostaa  ele ta falando do Atlético MG,há 2 anos,0,
" @fabriciocostaa  seu burro sabe nada de futebol, por causo vc não viu o 3 a 1 que o santos tomou do Atlético mineiro",há 2 anos,0,
" @guilhermemorais8356  santos 1 x 3 Atlético mineiro

Amigo seu santinhos perdeu de 3 e de 4",há 2 anos,0,
"POXA VIDA CARA  TAMBEM , NÃO SEI VC PERCEBEU MAS VEJA BEM  OS TIMES GRANDES DA SERIE A SÃO MUITO SOLIDÁRIOS COM ESSE PÉIXE E DAÍ ADORAM DAR UMA MÃOZINHO PARA ESSE SANTOS SÓ PORQUE  O PELÉ JOGOU POR LÁ, É INCREIVEL PARA TUDO COMBINADO EM AJUDAR O SANTOS,  TODO ANO É ASSIM. DESSE JEITO O SANTOS NÃO CAI NE, QUEA VACA TUSSA ,ASSIM É MAIS FACIL O MUNDO ACABAR DO QUE O SANTOS CAIR,PESSOAL NDVMP",há 2 anos,0,
 @edinhosantos4694  Ok👍,há 2 anos,0,
Pera mano está a 5 pontos pera,há 2 anos,1,
Esse Narrador tem futuro,há 2 anos,0,
Tenho o Madson no meu Cartola!,há 2 anos,0,
"Futebol é  uma coisa incrível,  ganha do melhor time  do Brasil e perde para o time medíocre  do Santos, vai entender..",há 2 anos,0,
"Aí é foda, como Santos vai cair desse jeito ?",há 2 anos,0,1
Santos sempre Santos!,há 2 anos,0,2
Inacreditáveis os gols que o time do Atlético PR perdeu.,há 2 anos,0,
VAMOOOOO GANHAAAAR SANTOOOOOS,há 2 anos,1,
"SANTOS SEMPRE SANTOS POOHAAAAAA 
😍😍🐋🐋🐋🐋🐋❤❤",há 2 anos (editado),1,
"Santos é aquele time que ninguém se importa, ninguém comenta, ninguém tá nem aí. Pelé é maior que o Santos kkkkkk",há 2 anos,0,
Quem quiser com narração va pra lá,há 2 anos,1,
Na tnt sports tem narração,há 2 anos,1,
Como o time do furacão perde pra esse time ruim  slk,há 2 anos,0,
O Santos fez gol no Santos e não foi gol contra.,há 2 anos,0,
SANTOS SEMPRE SANTOSSS,há 2 anos,0,
"Em segundo algumas vezes,na segunda jamais...É o SANTOS Fiii porra",há 2 anos,0,
É o SANTOS Fiii porra,há 2 anos,0,
"Pqp, nem tô acreditando....que reação Santastico....vamos 🐟",há 2 anos,0,1
"Futebol é muito ingrato mesmo. O resultado do jogo deveria ser 3 x 1 ou 4 x 1 para o Furacão! Apesar da derrota, o furacão jogou demais!",há 2 anos,2,1
Ahtletico jogou bem mais que o Santos merecia a vitória,há 2 anos,0,1
SANNNNNNNTOOOOOOSSS,há 2 anos,0,
"POXA VIDA CARA  TAMBEM , NÃO SEI VC PERCEBEU MAS VEJA BEM  OS TIMES GRANDES DA SERIE A SÃO MUITO SOLIDÁRIOS COM ESSE PÉIXE E DAÍ ADORAM DAR UMA MÃOZINHO PARA ESSE SANTOS SÓ PORQUE  O PELÉ JOGOU POR LÁ, É INCREIVEL PARA TUDO COMBINADO EM AJUDAR O SANTOS,  TODO ANO É ASSIM. DESSE JEITO O SANTOS NÃO CAI NE, QUEA VACA TUSSA ,ASSIM É MAIS FACIL O MUNDO ACABAR DO QUE O SANTOS CAIR,PESSOAL NDVMP",há 2 anos,1,
"POXA VIDA CARA  TAMBEM , NÃO SEI VC PERCEBEU MAS VEJA BEM  OS TIMES GRANDES DA SERIE A SÃO MUITO SOLIDÁRIOS COM ESSE PÉIXE E DAÍ ADORAM DAR UMA MÃOZINHO PARA ESSE SANTOS SÓ PORQUE  O PELÉ JOGOU POR LÁ, É INCREIVEL PARA TUDO COMBINADO EM AJUDAR O SANTOS,  TODO ANO É ASSIM. DESSE JEITO O SANTOS NÃO CAI NE, QUEA VACA TUSSA ,ASSIM É MAIS FACIL O MUNDO ACABAR DO QUE O SANTOS CAIR,PESSOAL NDVMP",há 2 anos,0,
" @edinhosantos4694  falou pouco, mas falou merda.",há 2 anos,0,
"POXA VIDA CARA  TAMBEM , OS TIMES GRANDES DA SERIE A SÃO MUITO SOLIDÁRIOS COM ESSE PÉIXE E DAÍ ADORAM DAR UMA MÃOZINHO PARA ESSE SANTOS SÓ PORQUE  O PELÉ JOGOU POR LÁ, É INCREIVEL PARA TUDO COMBINADO EM AJUDAR O SANTOS,  TODO ANO É ASSIM. DESSE JEITO O SANTOS NÃO CAI NE, QUEA VACA TUSSA ,ASSIM É MAIS FACIL O MUNDO ACABAR DO QUE O SANTOS CAIR,PESSOAL NDVMP",há 2 anos,0,
"POXA VIDA CARA  TAMBEM , OS TIMES GRANDES DA SERIE A ADORAM DAR UMA MÃOZINHO PARA ESSE SANTOS SÓ PORQUE  O PELÉ JOGOU POR LÁ, É INCREIVEL PARA TUDO COMBINADO EM AJUDAR O SANTOS,  TODO ANO É ASSIM. DESSE JEITO O SANTOS NÃO CAI NE, QUEA VACA TUSSA ,ASSIM É MAIS FACIL O MUNDO ACABAR DO QUE O SANTOS CAIR,PESSOAL NDVMP",há 2 anos,0,
"POXA VIDA CARA  TAMBEM , NÃO SEI VC PERCEBEU MAS VEJA BEM  OS TIMES GRANDES DA SERIE A SÃO MUITO SOLIDÁRIOS COM ESSE PÉIXE E DAÍ ADORAM DAR UMA MÃOZINHO PARA ESSE SANTOS SÓ PORQUE  O PELÉ JOGOU POR LÁ, É INCREIVEL PARA TUDO COMBINADO EM AJUDAR O SANTOS,  TODO ANO É ASSIM. DESSE JEITO O SANTOS NÃO CAI NE, QUEA VACA TUSSA ,ASSIM É MAIS FACIL O MUNDO ACABAR DO QUE O SANTOS CAIR,PESSOAL NDVMP",há 2 anos,0,
😁😁😁😁😁 quem achou que ia cair  pra B se F*****,há 2 anos (editado),0,
Olé lé  ola lá segunda divisão é pra porco 🐷 e pra gambá 🦨,há 2 anos,0,
Eu tenho dó  do Santos coitado...,há 2 anos,0,
Bela narração👏,há 2 anos,2,
a gente teve mais sorte que juizo,há 2 anos,0,
Renato Kayzer o pai tá aqui !! 🤭🤣🤣🤣,há 2 anos,1,
Incaivel futebol clube,há 2 anos,0,
Narração tão perfeita que não tem como falar mal,há 2 anos,0,
Time grande não cai tmj👊👊,há 2 anos,0,1
Já falei várias vezes que o Madson tem que jogar de centroavante; sería artilheiro do brasileiro,há 2 anos,0,
Impressionante essa narração,há 2 anos,0,
Time grande não cai ... série B é para outro nível tipo nível vergonhoso.Meu tataravô meu bisavô meu avô meu pai eu nunca vi e nunca vou ver o Peixe na série B kkkkkkkk,há 2 anos,0,
"Como o Flamengo faz 4x0 no Santos, perde pra o Athletico de 3x0 e depois o Santos ganha de 1x0 desse mesmo Athletico? Coisa louca o futebol!!!",há 2 anos,0,3
"só falta arrumar a zaga, peixão ta vivo <3",há 2 anos,0,
"Essa defesa é uma baba, por isso estamos assim, arruma isso pelo amor de Deus. Essas falhadas não dá 🙏🙏🙏",há 2 anos (editado),0,
Santos Gigante Não Cai,há 2 anos,0,
Por mais transmissão sem narrador e comentaristas... Melhor experiência ouvir só o som ambiente do estádio..... Todo canal a cabo e aplicativo de transmissão deveria oferecer essa opção...,há 2 anos,0,
"1:16 Jogador profissional dar uma furada dessa, nem na várzea os perna de pau faz isso, quase comprometeu o resultado aff",há 2 anos (editado),0,
Jamais cairá,há 2 anos,0,
"Atlético PR é muito humilde, eliminou o Flamengo e ainda salvou o Santos da série B",há 2 anos,5,1
"POXA VIDA CARA  TAMBEM , NÃO SEI VC PERCEBEU MAS VEJA BEM  OS TIMES GRANDES DA SERIE A SÃO MUITO SOLIDÁRIOS COM ESSE PÉIXE E DAÍ ADORAM DAR UMA MÃOZINHO PARA ESSE SANTOS SÓ PORQUE  O PELÉ JOGOU POR LÁ, É INCREIVEL PARA TUDO COMBINADO EM AJUDAR O SANTOS,  TODO ANO É ASSIM. DESSE JEITO O SANTOS NÃO CAI NE, QUEA VACA TUSSA ,ASSIM É MAIS FACIL O MUNDO ACABAR DO QUE O SANTOS CAIR,PESSOAL NDVMP",há 2 anos,0,
Isso foi pura sorte mn,há 2 anos,0,
Flamengo só venceu o Santos por 4 a zero pq o marinho o velazquez o caceres o Léo batistão e Júnior Moraes não jogaram esse partida o Santos estava com diversos desfalques se o Santos tivesse com o time completo e todos os jogadores à disposição nunca que eles teriam vencido o Santos,há 2 anos (editado),0,
 @lucasgoncalves1713  os cara lá que vaiaram o Gabigol também tiveram uma culpa kkkkkk,há 2 anos,0,
"POXA VIDA CARA  TAMBEM , OS TIMES GRANDES DA SERIE A ADORAM DAR UMA MÃOZINHO PARA ESSE SANTOS SÓ PORQUE  O PELÉ JOGOU POR LÁ, É INCREIVEL PARA TUDO COMBINADO EM AJUDAR O SANTOS,  TODO ANO É ASSIM. DESSE JEITO O SANTOS NÃO CAI NE, QUEA VACA TUSSA ,ASSIM É MAIS FACIL O MUNDO ACABAR DO QUE O SANTOS CAIR,PESSOAL NDVMP",há 2 anos,0,
"Em segundo algumas vezes mas na SEGUNDA JAMAIS
TORCIDA JOVEM SANTOS
RESPEITA TIME GIGANTE NAO CAI
8-3-2",há 2 anos,0,
Como e bom ver o athletico sempre perdendo( dale meu Santos )  ( Sergio Londres u.k ),há 2 anos,1,
"Acho que os sardinhas não cai mais..Mas tbm se na série A já é difícil encontrar um san7ista, imagine na série B",há 2 anos,0,4
Santos meu amor,há 2 anos,1,
Ganhou do Malvadão e perdeu para o Peixe kkkkkk se lascaram,há 2 anos,1,
Ninguém mandou mecher com meu filho Flamengo,há 2 anos,2,4
"Santos tá começando a supera no campeonato está na luta pra nn cair pra série B , parabéns peixão 👊🏻⚽️",há 2 anos,1,1
"Chupa gambazada, porcada e bixarada aqui é Santos porra",há 2 anos,0,2
Como os favoritos sempre perdem de uma forma vergonhosa kkkk,há 2 anos,0,1
Mano näo da pra acreditar que o flamengo perdeu de treis pra esse  timeque até o Santos ganha.Olha que nem torço pro flamengo,há 2 anos,0,
As narrações dos jogos do athetico é emocionante cara😭😭,há 2 anos,2,
"Atlético paranaense perdeu gols incríveis! É aquela velha e conhecida frase: quem não faz leva. Jogou muito, mas...",há 2 anos,2,1
Tá de palhaçada a série B é coisa pra porcada 🎶 Vamos Santos!!!,há 2 anos,0,1
"Impressionante como a torcida do Pathletico-PR gosta de Xingar os jogadores do Time Adversário viu
Sem necessidade Mano
Esse rebanho de Merdas é lá torcida Rapaz.",há 2 anos,0,
Fudeu pro grêmio 😲,há 2 anos,0,
Time grande não cai!,há 2 anos,0,
Sabe pq o meu Santos ganhou? Ñ existe cara mais zicado no Cartola q eu. Santista roxo usei a psicologia do contra. Escalei todo Atlhetico PR no meu Cartola. Zicado q SOU. Deu certo. Vamos Santos.,há 2 anos,0,1
O atlético So ganha quando joga na retranca,há 2 anos,0,
O PEIXÃO TÁ ON,há 2 anos,0,
"Carille é um baita treinador mesmo,se vê o valor de um treinador quando o cara tira leite de pedra! Volta Carilleeee!😫😫",há 2 anos,0,
Chora anti 🤩🤍🖤🅰️🐳,há 2 anos,2,
Segura o Santastico,há 2 anos,2,
Fica quieto seu burro,há 2 anos,1,
Ainda não acabou kkkk,há 2 anos,0,
"POXA VIDA CARA  TAMBEM , NÃO SEI VC PERCEBEU MAS VEJA BEM  OS TIMES GRANDES DA SERIE A SÃO MUITO SOLIDÁRIOS COM ESSE PÉIXE E DAÍ ADORAM DAR UMA MÃOZINHO PARA ESSE SANTOS SÓ PORQUE  O PELÉ JOGOU POR LÁ, É INCREIVEL PARA TUDO COMBINADO EM AJUDAR O SANTOS,  TODO ANO É ASSIM. DESSE JEITO O SANTOS NÃO CAI NE, QUEA VACA TUSSA ,ASSIM É MAIS FACIL O MUNDO ACABAR DO QUE O SANTOS CAIR,PESSOAL NDVMP",há 2 anos,0,
" @edinhosantos4694  VOCÊ TA MALUCO CARA? O SANTOS SÓ TOMOU PREJUÍZO PELA ARBITRAGEM E LEVANDO SACODE DE TIME PEQUENO PORQUE OS GRANDES ELE AMASSA 
NOIS TA PIQUE ROBIN HOOD",há 2 anos,0,
 @edinhosantos4694  PAPO RETO NÃO TEM ESSA HISTÓRIA CARA.. HOJE MESMO O SANTOS PODERIA TER TOMADO UNS 3 E FEITO TAMBÉM ENTÃO O BAGULHO É A HISTÓRIA DO TIME QUE FAZ O JOGADOR HONRAR,há 2 anos,0,
 @santistacruel0194  NÃO CAI PORQUE O CLUBE DOS 13 NÃO DEIXA ELE CAIR FACILITANDO DE PROPOSITO  O JOGO SÓ POR CAUSA DESSE PELÉ QUE PASSOU POR LÁ E É IDOLO ETERNO NDVMP,há 2 anos,0,
"POXA VIDA CARA  TAMBEM , OS TIMES GRANDES DA SERIE A ADORAM DAR UMA MÃOZINHO PARA ESSE SANTOS SÓ PORQUE  O PELÉ JOGOU POR LÁ, É INCREIVEL PARA TUDO COMBINADO EM AJUDAR O SANTOS,  TODO ANO É ASSIM. DESSE JEITO O SANTOS NÃO CAI NE, QUEA VACA TUSSA ,ASSIM É MAIS FACIL O MUNDO ACABAR DO QUE O SANTOS CAIR,PESSOAL NDVMP",há 2 anos,0,
